{
  "arm_label": "sidebutton-cold-opus48",
  "account": "benchmarks",
  "workspace": "tb-2-1",
  "agent_import_path": "sidebutton_harbor_agent:SidebuttonAgent",
  "backend_model": "anthropic/claude-opus-4-8",
  "reasoning_effort": "high",
  "priming": "cold",
  "skill_packs": [],
  "pack_repo_commit": "1a2b3c4d5e6f7a8b9c0d1e2f3a4b5c6d7e8f9a0b",
  "dataset": "terminal-bench/terminal-bench-2-1@v2.1.0",
  "k_trials": 5,
  "sandbox": "daytona",
  "concurrency": 16,
  "include_tasks": "all",
  "upload_public": false
}
